<?xml version="1.0" encoding="UTF-8"?>
<!DOCTYPE mimiqq SYSTEM "xml/mimiqq.dtd">
<mimiqq xmlns="www.orchid.party/mimiqq">
	<recordreqback>
		<recordlist>
			<listlength>2</listlength>
			<record recordtype="MESSAGE">
				<ownerid>1058712592</ownerid>
				<targetid type="user">10000000</targetid>
				<recorddate>16-05-27 22:41:14</recorddate>
				<data>I Love you</data>
			</record>
			<record recordtype="MESSAGE">
				<ownerid>10000000</ownerid>
				<targetid type="user">1058712592</targetid>
				<recorddate>16-05-27 22:42:14</recorddate>
				<data>I Love you,too</data>
			</record>
		</recordlist>
		<beforeday>0.1</beforeday>
	</recordreqback>
</mimiqq>