<?xml version="1.0" encoding="UTF-8"?>
<!DOCTYPE mimiqq SYSTEM "xml/mimiqq.dtd">
<mimiqq xmlns="www.orchid.party/mimiqq">
<searchback>
	<userlist>
		<listlength>2</listlength>
		<user>
			<uid>1058712592</uid>
			<nickname>Rock</nickname>
			<email>123</email>
			<imageurl>rock.png</imageurl>
			<onlinestate olstype="N"/>
		</user>
		<user>
			<uid>100000001</uid>
			<nickname>puppy</nickname>
			<email>123456</email>
			<imageurl>puppy.png</imageurl>
			<onlinestate olstype="Y"/>
		</user>
	</userlist>
	<flocklist>
		<listlength>1</listlength>
		<flock>
			<fid>Linux</fid>
			<name>LL</name>
			<createrid>1058712592</createrid>
			<createdate>123</createdate>
			<imageurl>ll.png</imageurl>
			<notes>Hello,Linux os</notes>
		</flock>
	</flocklist>
</searchback>
</mimiqq>